K1,K2,K3,D1,D2,D3,,,,Additional,City,State,,Start Time,Time Zone,,,,,
,,,sb,ykh,,,Canvass with Team Jason!,Come knock doors for Jason in the final weekend before the primary! We need all hands on deck to make sure Jason gets a chance to take on Dino Rossi in the general!,,,,"411 E St NE, Auburn, WA 98002-4330, United States - ",10:00:00,7,2018-08-05T10:00:00-0700,https://www.facebook.com/events/186786295528796/,Canvass with Team Jason!,https://www.facebook.com/JasonRittereiserforCongress/,8/5/2018
,,,sb,ykh,,,Team Schrier Wenatchee Canvass,"Join Team Kim to knock on doors in Wenatchee. We'll be talking to voters about the issues that matter most about them and spreading the word about why we know Dr. Kim Schrier is the best candidate to represent the 8th District in Congress! 

First-time canvassers are encouraged to join! Training will be provided. 

Sign up using the RSVP link or email info@drkimschrier.com for more information.",,,,"Memorial Park Wenatchee-2 S Chelan Ave, Wenatchee, WA 98801 - ",10:00:00,7,2018-08-04T10:00:00-0700,https://www.facebook.com/events/247985629327051/,Team Schrier Wenatchee Canvass,https://www.facebook.com/DrKimSchrier/,8/4/2018
,,,sb,ykh,,,Canvass with Team Jason in Sammamish!,Come knock doors with Team Jason in Sammamish the last weekend before the election!,,,,"Sammamish City Hall - Sammamish, WA",11:00:00,7,2018-08-05T11:00:00-0700,https://www.facebook.com/events/694386550903366/,Canvass with Team Jason in Sammamish!,https://www.facebook.com/JasonRittereiserforCongress/,8/5/2018
,,,sb,ykh,,,Canvass with Cort,"Join Team Cort to canvass with us on Saturday, Aug. 4 at 4 pm. Meet at our campaign office in Manchester, and help us canvass parts of the Second to get out the vote on Aug. 7!",,,,"629 Big Bend Rd, Ballwin, MO 63021-7723, United States - ",16:00:00,5,2018-08-04T16:00:00-0500,https://www.facebook.com/events/1343151822483113/,Canvass with Cort,https://www.facebook.com/cortforcongress/,8/4/2018
,,,sb,ykh,,,Canvass with Cort,"Join Team Cort to canvass on Sunday, August 5 at 11 a.m. Meet at our campaign office in Manchester and help us canvass parts of the Second to get the vote out on Aug. 7!",,,,"629 Big Bend Rd, Ballwin, MO 63021-7723, United States - ",11:00:00,5,2018-08-05T11:00:00-0500,https://www.facebook.com/events/210985652950110/,Canvass with Cort,https://www.facebook.com/cortforcongress/,8/5/2018
,,,sb,ykh,EG,Delete,Get Out the Vote Phone Bank,Come phone bank with Cort to get out the vote for the Aug. 7 primary!,,,,"629 Big Bend Rd, Ballwin, MO 63021-7723, United States - ",13:00:00,5,2018-08-05T13:00:00-0500,https://www.facebook.com/events/2119759261632995/,Get Out the Vote Phone Bank,https://www.facebook.com/cortforcongress/,8/5/2018
,,,sb,ykh,,,Canvass with Cort,"Join Team Cort to canvass with us on Sunday, Aug. 5 at 4 pm. Meet at our campaign office in Manchester, and help us canvass parts of the Second to get out the vote on Aug. 7!",,,,"629 Big Bend Rd, Ballwin, MO 63021-7723, United States - ",16:00:00,5,2018-08-05T16:00:00-0500,https://www.facebook.com/events/2123215537950589/,Canvass with Cort,https://www.facebook.com/cortforcongress/,8/5/2018
,,,sb,ykh,,,Rocklin Canvass Launch,"Join our Rocklin Host, Millie, for a canvass training and canvassing shift in Rocklin! Sign up to volunteer for a shift from 9AM-12PM by RSVPing to zoe@morse4congress.com. Bring a phone, friend, and smile. Look forward to hitting the pavement with you this weekend!",,,,"Millie's home, CORNER OF TRAIL DUST LANE AND CREEK HOLLOW ROAD, ROCKLIN, CA 95765 - ",9:00:00,7,2018-08-04T09:00:00-0700,https://www.facebook.com/events/2109609119326701/,Rocklin Canvass Launch,https://www.facebook.com/Morse4America/,8/4/2018
,,,sb,ykh,,,Deschutes: Canvassing with Jamie!,"CANVASS SATURDAY
SPECIAL GUEST
Saturday, August 4th
9:30-12:00
COMPASS PARK

Come at 9:30, get your assignment, any training needed and check in with each other. 
At 10:00, Jamie will join us and talk for a few minutes. 

PLEASE RSVP here https://secure.ngpvan.com/0hZerVC0ZESQVAC9YExpMA2

Then we’ll be off doing our turfs. We have a big goal this weekend—20 canvassers and 600 doors. 

Come help us do this important task and meet the candidate. 

Thanks, thanks, thanks. 
Patricia DeLozier, volunteer
505-710-5639",,,,"Compass Park - Bend, OR",9:30:00,7,2018-08-04T09:30:00-0700,https://www.facebook.com/events/1589782784477563/,Deschutes: Canvassing with Jamie!,https://www.facebook.com/JamieForOregon/,8/4/2018
,,,sb,EG,,,"Canvass for Lois Herr, Shanna Danielson and George Scott!","Join Lois Herr for PA Senate, Shanna Danielson for PA 92, and George Scott for Congress for a day of canvassing!

With less than 100 days until the general election, it is important that we reach as many voters as we can. Join us as we speak with voters about the importance of voting in November. Get your sneakers ready and help us to gain support for our democratic candidates in York County! 

We will be canvassing in Newberry Township on Saturday, August 11th, and have two shifts available:
10am-1pm
1pm-4pm

Meeting place will be Newberry Storage, 1969 York Haven Rd, Goldsboro, PA 17319.

To sign up for a canvassing shift, learn about other opportunities to get involved, and for questions, contact one of the following:

Theresa Gassert
tgass726@gmail.com
717-679-5373

Bernie Flinchbaugh
gpixie@ptd.net

Sam Fullam
sfullam@padems.com 

To learn more about the candidates, check out their websites:

www.LoisHerrforPASenate.com
www.shannaforpa92.com
georgescott4congress.com

We hope to see you Saturday, August 11th!",,,,"Newberry Storage - Etters, PA",10:00:00,4,2018-08-11T10:00:00-0400,https://www.facebook.com/events/214762069222374/,"Canvass for Lois Herr, Shanna Danielson and George Scott!",https://www.facebook.com/GeorgeScott4Congress/,8/11/2018
,,,sb,,,,Field Office Opening,"We're opening our newest Field Office in Huntington Beach! Please bring a friend and join us on our first big canvass launch out of the new office.

RSVP for details: https://events.mobilizeamerica.io/roudaforcongress/event/8025/",,,,"Huntington Beach, CA - ",11:00:00,7,2018-08-04T11:00:00-0700,https://www.facebook.com/events/1941390629494071/,Field Office Opening,https://www.facebook.com/HarleyforCongress/,8/4/2018
sb,,,,,,,LD 22 Joint Canvass with Brianna Westbook,"Join us for our LD22 Canvassing Campaign Kickoff with LD22 State Senate Candidate Brianna Westbrook. We'll be launching from our office located 12370 N 83rd Ave., Suite 108 at 9am sharp!",,,,"Hiral Tipirneni - Peoria, AZ",9:00:00,7,2018-08-04T09:00:00-0700,https://www.facebook.com/events/185576318803314/,LD 22 Joint Canvass with Brianna Westbook,https://www.facebook.com/hiralforcongress/,8/4/2018
sb,,,,,,,Spanish Language Canvass for James Thompson,"Join James for a Spanish language canvass in Wichita! Spanish language skills are encouraged, but not required. Kids are welcome! 

We will meet at the James Thompson for Kansas office for training and to team up.",,,,"James Thompson for Kansas - Wichita, KS",18:00:00,5,2018-08-05T18:00:00-0500,https://www.facebook.com/events/671487126551294/,Spanish Language Canvass for James Thompson,https://www.facebook.com/votejamesthompson/,8/5/2018
,,,sb,,,,Primary Day Canvass for James Thompson,"Support Team Thompson on primary day by helping get out the vote! Wear your Thompson gear (don't have any? Pick up a shirt at the office), your walking shoes, and get ready for a great day of talking to voters! Never canvassed before? No problem! We'll teach you everything you need to know about canvassing!",,,,"James Thompson for Kansas - Wichita, KS",10:00:00,5,2018-08-07T10:00:00-0500,https://www.facebook.com/events/440400093128452/,Primary Day Canvass for James Thompson,https://www.facebook.com/votejamesthompson/,8/7/2018
sb,,,,,,,JeffCo Canvass Launch,"Please join Dianne in Lakewood this Sunday, August 5 at 10:00 am! We look forward to getting outside to ensure that everyone in your community hears about our bold vision for Colorado.",,,,"145 S Sheridan Blvd #228, Lakewood, CO 80226-2400, United States - ",10:00:00,6,2018-08-05T10:00:00-0600,https://www.facebook.com/events/2104510282940945/,JeffCo Canvass Launch,https://www.facebook.com/PolisForColorado/,8/5/2018
sb,,,,,,,Adams County Canvass Launch,"Please join Dianne in Adams County on Saturday, August 18 at 4:00 pm! We look forward to getting outside to ensure that everyone in your community hears about our bold vision for Colorado.",,,,"7245 Gilpin Way Suite #160, Denver, CO 80229-6506, United States - ",16:00:00,6,2018-08-18T16:00:00-0600,https://www.facebook.com/events/239792409988128/,Adams County Canvass Launch,https://www.facebook.com/PolisForColorado/,8/18/2018
,,,sb,,,,Douglas County Canvass and Phonebank,"Come out to help us canvass in Douglas County! We need your help to mobilize your friends and neighbors. Join us this Saturday as we continue on our path of flipping the House.

Don't forget water, a pen, and sunscreen! We will have some for those who forget. If you got a clipboard at our Mega-Canvass, or have an extra clipboard, bring that along too!

Please sign up at: https://events.mobilizeamerica.io/crowforcongress/event/8030/",,,,"9831 S Westbury Way, Littleton, CO 80129-6932, United States - ",10:00:00,6,2018-08-04T10:00:00-0600,https://www.facebook.com/events/1891573564214653/,Douglas County Canvass and Phonebank,https://www.facebook.com/JasonCrowforCongress/,8/4/2018
,,,sb,,,,Adams County Canvass and Phonebank,"Come out to help us canvass in Adams County! We need your help to mobilize your friends and neighbors. Join us on  Saturday the 11th as we continue on our path of flipping the House. There will be opportunities to canvass, phonebank, textbank, as well as help us write postcards.

Don't forget water, a pen, and sunscreen! We will have some for those who forget. If you have an extra clipboard, bring that along too!

Sign up here: https://events.mobilizeamerica.io/crowforcongress/event/8532/",,,,"327 E Bridge St, Brighton, CO 80601-2018, United States - ",11:00:00,6,2018-08-11T11:00:00-0600,https://www.facebook.com/events/657748347927531/,Adams County Canvass and Phonebank,https://www.facebook.com/JasonCrowforCongress/,8/11/2018
,,,sb,,,,"Canvassing For Jess King Hanover, PA","Please come out and canvass for Jess King, our Democratic candidate for United States House of Representatives in PA District 11. 

Shifts typically run between 10:00am - 1:00pm and from 1:00pm - 4:00pm, but there's room for flexibility. 

First time canvassing? No problem! 

Jess' campaign has packets, scripts, and an easy to use app to make canvassing a breeze! 

What: Canvassing for Jess King
Where: Anna Kruk Corbin's Home
              509 Boundary Avenue
              Hanover, PA 17331
When: Saturday, August 4th, 10:00am-4:00pm

https://jesskingforcongress.com/",,,,"509 Boundary Avenue Hanover, PA 17331 - ",10:00:00,4,2018-08-04T10:00:00-0400,https://www.facebook.com/events/456937358050033/,"Canvassing For Jess King Hanover, PA",https://www.facebook.com/jesskingforcongress/,8/4/2018
,,,sb,,,,Hanover / West Manheim Block Walk,"Join Jess King and the Hanover volunteer campaign team for a Block Walk! Jess will start things off, and then our Hanover team leader and our field staff will give a brief training on door knocking before we all go out and canvass! The whole thing will take about 3 hours.

Canvassing is the most effective way of getting out the vote. Most of our campaign volunteers are first-time canvassers. This is a great opportunity to meet your neighbors, get trained up, and support the movement to get Jess elected.

Please bring a charged smartphone if you have one!",,,,"18 Saint Rene Ln, Hanover, PA 17331-8493, United States - ",13:00:00,4,2018-08-05T13:00:00-0400,https://www.facebook.com/events/1039941392832425/,Hanover / West Manheim Block Walk,https://www.facebook.com/jesskingforcongress/,8/5/2018
,,,sb,,,,Spring Grove Block Walk,"Join Jess King and the Spring Grove volunteer campaign team for a Block Walk! Jess will start things off, and then our Spring Grove team leader and our field staff will give a brief training on door knocking before we all go out and canvass! The whole thing will take about 3 hours.

Canvassing is the most effective way of getting out the vote. Most of our campaign volunteers are first-time canvassers. This is a great opportunity to meet your neighbors, get trained up, and support the movement to get Jess elected.

Please bring a charged smartphone if you have one!",,,,"201 E Railroad St, Spring Grove, PA 17362, United States - ",16:00:00,4,2018-08-05T16:00:00-0400,https://www.facebook.com/events/204731113718004/,Spring Grove Block Walk,https://www.facebook.com/jesskingforcongress/,8/5/2018
,,,sb,,,,Ephrata Block Walk,"Join Jess King and the Ephrata/Akron volunteer campaign team for a Block Walk! Jess will start things off, and then our Ephrata team leader and our field staff will give a brief training on door knocking before we all go out and canvass! The whole thing will take about 3 hours.

Canvassing is the most effective way of getting out the vote. Most of our campaign volunteers are first-time canvassers. This is a great opportunity to meet your neighbors, get trained up, and support the movement to get Jess elected.

Please bring a charged smartphone if you have one!",,,,"129 E Franklin St, Ephrata, PA 17522-2448, United States - ",17:30:00,4,2018-08-07T17:30:00-0400,https://www.facebook.com/events/209697996395245/,Ephrata Block Walk,https://www.facebook.com/jesskingforcongress/,8/7/2018
,,,sb,,,,SCV Voter Registration/Listening Tour Canvass!,"Please RSVP: http://bit.ly/2LQ97jK

Join the Katie Hill for Congress team in Santa Clarita. We'll start with a quick training and then head out into the community to register voters and spread the word about our awesome democratic candidates and the Nov. 6th general election! 

Feel free to email jill@katiehillforcongress.com with any questions.",,,,"25269 The Old Road, Unit B, Stevenson Ranch, CA, 91321 - ",9:00:00,7,2018-08-04T09:00:00-0700,https://www.facebook.com/events/295742481170893/,SCV Voter Registration/Listening Tour Canvass!,https://www.facebook.com/KatieHillforCongress/,8/4/2018
,,,sb,,,,AV Voter Registration/Listening Tour Canvass!,"RSVP Here: http://bit.ly/2ObQSGN

Join the Katie Hill for Congress campaign in the Antelope Valley. We'll start with a quick training and then head out into the community to register voters and spread the word about Katie and the Nov. 6th general election!

Feel free to email jill@katiehillforcongress.com with any questions.",,,,"820 E Avenue K, Lancaster, CA 93535-4766, United States - ",16:00:00,7,2018-08-04T16:00:00-0700,https://www.facebook.com/events/2194558800777340/,AV Voter Registration/Listening Tour Canvass!,https://www.facebook.com/KatieHillforCongress/,8/4/2018
,,,sb,,,,Simi Valley Voter Reg/Listening Tour Canvass!,"Please RSVP: http://bit.ly/2NJXZoL

Join the Katie Hill for Congress campaign in Simi Valley. We'll start with a quick training and then head out into the community to register voters and spread the word about Katie, Christy, and the Nov. 6th general election! 

Feel free to email jill@katiehillforcongress.com with any questions.",,,,"297 Longbranch Rd, Simi Valley, CA 93065-5326, United States - ",9:00:00,7,2018-08-05T09:00:00-0700,https://www.facebook.com/events/265913407338096/,Simi Valley Voter Reg/Listening Tour Canvass!,https://www.facebook.com/KatieHillforCongress/,8/5/2018
,,,sb,,,,Simi Valley Voter Reg/Listening Tour Canvass!,"Please RSVP: http://bit.ly/2LNjwjm

Join the Katie Hill for Congress campaign in Simi Valley. We'll start with a quick training and then head out into the community to register voters and spread the word about Katie, Christy, and the Nov. 6th general election! 

Feel free to email jill@katiehillforcongress.com with any questions.",,,,TBD -,9:00:00,7,2018-08-11T09:00:00-0700,https://www.facebook.com/events/458782054594381/,Simi Valley Voter Reg/Listening Tour Canvass!,https://www.facebook.com/KatieHillforCongress/,8/11/2018
,,,sb,,,,SCV Voter Registration/Listening Tour Canvass!,"Please RSVP: http://bit.ly/2Kb5pPK

Join the Katie Hill for Congress team in Santa Clarita. We'll start with a quick training and then head out into the community to register voters and spread the word about our awesome democratic candidates and the Nov. 6th general election! 

Feel free to email jill@katiehillforcongress.com with any questions.",,,,"25269 The Old Road, Unit B, Stevenson Ranch, CA, 91321 - ",16:00:00,7,2018-08-11T16:00:00-0700,https://www.facebook.com/events/2143495839228917/,SCV Voter Registration/Listening Tour Canvass!,https://www.facebook.com/KatieHillforCongress/,8/11/2018
,,,sb,,,,Franklin County Canvass!,Come knock on doors in Franklin County for Leslie. It's never too early to start talking to neighbors about what is at stake in this election! We need to make sure that voters in #VA05 know why Leslie Cockburn is the best choice this November.,,,,"527 South Main Street, Rocky Mount, VA 22902 - ",9:00:00,4,2018-08-04T09:00:00-0400,https://www.facebook.com/events/394056357789196/,Franklin County Canvass!,https://www.facebook.com/LeslieforCongress/,8/4/2018
,,,sb,,,,Halifax County Canvass!,Come knock on doors in Halifax County for Leslie. It's never too early to start talking to neighbors about what is at stake in this election! We need to make sure that voters in #VA05 know why Leslie Cockburn is the best choice this November.,,,,"3103 Halifax Rd, South Boston, VA 24592-4905, United States - ",9:00:00,4,2018-08-04T09:00:00-0400,https://www.facebook.com/events/2060936477270313/,Halifax County Canvass!,https://www.facebook.com/LeslieforCongress/,8/4/2018
,,,sb,,,,Canvassing with Linda in North Raleigh,We need to get out the vote in North Raleigh and we need your help to do it. Lets get this done!,,,,"5600 Sweetbriar St, Raleigh, NC 27609, United States - ",10:00:00,4,2018-08-04T10:00:00-0400,https://www.facebook.com/events/211923982815897/,Canvassing with Linda in North Raleigh,https://www.facebook.com/LindaColemanForCongress/,8/4/2018
,,,sb,,,,Weekly Canvas Sundays 2pm Meetup until November 4th,"We have a list of voters who we would like to invite to vote, invite to learn more about candidates and just learn more about us!   Put your walking shoes on and plan on a 90 minute friend-making adventure.  You can take the ""safe route"" asking known active voters to vote in the General Election, the ""middle of the road"" and see what Unaffiliated voters think about the Candidates, and ""the road less travelled"" and ask Inactive voters to take advantage of their constitutional rights that are so important in 2018 by re-registering to vote.  Please join us at 2pm at Hoppy Endings!  You do not have to be a precinct member to canvas with us, if you have time, this area hasn't been canvassed in years! We will join back up at 4pm at Hoppy Endings where a mug of bubbly awaits!",,,,"Hoppy Endings - Raleigh, NC",14:00:00,4,2018-10-21T14:00:00-0400,https://www.facebook.com/events/251225942091802/,Weekly Canvas Sundays 2pm Meetup until November 4th,https://www.facebook.com/LindaColemanForCongress/,10/21/2018
,,,sb,,,,Canvassing for Lisa and Jessa,"Join the Democratic Party for our canvassing event!

Hosted by Laborers Local 238 to support Lisa Brown and Jessa Lewis

Meet at the Laborers Local 238 Union Hall at 9:30AM for training then canvassing! Celebrate with us at a BBQ after the event at the union hall.

We will be joined by special guests Senator Andy Billig, Representative Timm Ormsby, Representative Marcus Riccelli, Kay Murano and more!

Please make sure to RSVP so we can have adequate food and lists!
https://www.wa-democrats.org/ngpvanforms/11694",,,,1330 N Calispell St Spokane Wa -,9:30:00,7,2018-08-04T09:30:00-0700,https://www.facebook.com/events/2216830055215596/,Canvassing for Lisa and Jessa,https://www.facebook.com/LisaBrown4Congress/,8/4/2018
sb,,,,,,,Knock Doors with Lisa Brown!,"Come knock on doors with Lisa herself! Canvassing is the best and most effective way to turn out voters and persuade undecideds. We'll send you out in groups of at least two with materials and scripts. Brief training at 2 pm, and we knock doors at 2:30 pm. Bring friends if you like!",,,,"1507 E Sprague Ave, Spokane, WA 99202-3112, United States - ",14:00:00,7,2018-08-04T14:00:00-0700,https://www.facebook.com/events/452157321862248/,Knock Doors with Lisa Brown!,https://www.facebook.com/LisaBrown4Congress/,8/4/2018
,,,sb,,,,Primary Election,Primary Election Day,,,,-,7:00:00,5,2018-08-14T07:00:00-0500,https://www.facebook.com/events/292507967956124/,Primary Election,https://www.facebook.com/swansonnolanmn/,8/14/2018
,,,sb,,,,GOTV Canvass for Mary Matiella,"Time to Get Out The Vote for Mary Matiella, the Progressive choice for CD-2!

Join us Saturday to talk to voters about why they should vote for Mary!

Saturday, August 4th
9:30am - 12:30pm

Pinecrest Park
4870 E Fairmount St
Tucson, AZ

RSVP to Carlos@Matiellaforcongress.com",,,,"Pinecrest Park - Tucson, AZ",9:30:00,7,2018-08-04T09:30:00-0700,https://www.facebook.com/events/270986627021755/,GOTV Canvass for Mary Matiella,https://www.facebook.com/MatiellaForCongress/,8/4/2018
sb,,,,,,,Back-To-School Canvass & School Supply Drive with Martin,"Join Martin and the Democratic Party of New Mexico for a back-to-school canvass and school supply drive at our new office in the NE heights! 

Please bring new or gently used school supplies to donate.",,,,1605 Juan Tabo Blvd NE Ste G -,11:30:00,6,2018-08-11T11:30:00-0600,https://www.facebook.com/events/254477551945298/,Back-To-School Canvass & School Supply Drive with Martin,https://www.facebook.com/TeamHeinrich/,8/11/2018
,,,sb,,,,Get Out The Vote - Allegan County!,"We have one last chance to get the word out about Matt before Get Out The Vote! Help us talk to every voter by signing up to help us Get Out The Vote. Even an hour goes a long way!

9am-12pm: canvassing, textbanking and phone banking

12-4pm: canvassing, textbanking and phone banking

4-9pm: canvassing, textbanking and phone banking

Can't make it for a full four hour shift? That's ok, stop by, even if it's only for half an hour! We need as much help as we can get, and we can't let a moment go to waste! Less",,,,"415 Wiley Rd, Douglas MI - ",9:00:00,4,2018-08-04T09:00:00-0400,https://www.facebook.com/events/232279224280045/,Get Out The Vote - Allegan County!,https://www.facebook.com/mattlongjohnforcongress/,8/4/2018
,,,sb,,,,Get Out The Vote - Berrien County!,"We have one last chance to get the word out about Matt before Get Out The Vote! Help us talk to every voter by signing up to help us Get Out The Vote. Even an hour goes a long way!

9am-12pm: canvassing, textbanking and phone banking.

12-4pm: canvassing, textbanking and phone banking.

4-9pm: canvassing, textbanking and phone banking.

Can't make it for a full four hour shift? That's ok, stop by, even if it's only for half an hour! We need as much help as we can get, and we can't let a moment go to waste!",,,,"Biggby Coffee 111 Main St, St Joseph, MI 49085-1107, United States - ",9:00:00,4,2018-08-05T09:00:00-0400,https://www.facebook.com/events/907501109443042/,Get Out The Vote - Berrien County!,https://www.facebook.com/mattlongjohnforcongress/,8/5/2018
,,,sb,,,,Election Night Watch Party,Come down to Bell’s on Tuesday August at 8PM for Matt Longjohn's primary night party!,,,,-,20:00:00,4,2018-08-07T20:00:00-0400,https://www.facebook.com/events/294686404630120/,Election Night Watch Party,https://www.facebook.com/mattlongjohnforcongress/,8/7/2018
,,,sb,,,,Max Rose Day of Action,"Day of Action to Elect Max Rose, who is running for congress in New York’s 11th Congressional District against Trump lover Dan Donovan. Rose’s record of public service will appeal to both Democrats and moderates, making this a key race in winning back the house in November!
Please join us in supporting Max Rose for congress and spread the word! 

Day of Action for Max Rose with You Matter Saturday, August 18 

Meeting Location Options:
Manhattan, Union Square, 12 Noon - in front of statue of George Washington.
Brooklyn, 9714 4th Ave, Bay Ridge, 12 Noon - at Max Rose for Congress Office 

If you have a car and are able to drive others to canvassing locations, please let us know. Kids are welcome, too! It is never too early to learn about political participation. Canvassing will conclude at 6pm with dinner at NYC’s finest pizzeria, L&B’s.

To sign up, please fill out this form. Prior to August 18, you may contact Julianne Ballington at organizing@youmatternation.com. On the Day of Action,  you may contact Benjamin Yee at (646) 385-0522.",,,,-,12:00:00,4,2018-08-18T12:00:00-0400,https://www.facebook.com/events/639469376409079/,Max Rose Day of Action,https://www.facebook.com/MaxRoseForCongress/,8/18/2018
,,,sb,,,,Canvass with Team Mike!,"Join Team Mike at any of our 3 offices as we canvass neighborhoods around our district to talk about Mike Levin!

𝗣𝗹𝗲𝗮𝘀𝗲 𝗦𝗶𝗴𝗻 𝗨𝗽 𝗛𝗲𝗿𝗲

Oceanside: events.mobilizeamerica.io/levinforcongress/event/7359/
San Clemente: events.mobilizeamerica.io/levinforcongress/event/7360/ 
Solana Beach: events.mobilizeamerica.io/levinforcongress/event/7356/",,,,"Mike Levin - Oceanside, CA",12:30:00,7,2018-08-11T12:30:00-0700,https://www.facebook.com/events/2106528642902105/,Canvass with Team Mike!,https://www.facebook.com/LevinforCongress/,8/11/2018
