K1,K2,K3,D1,D2,D3,,,,Additional,City,State,,Start Time,Time Zone,,,,,
,,,EG,SA,ykh,Delete,Door Knocking in Twin Falls with Aaron Swisher,Come knock doors with the Swisher team in twin falls!,,Twin Falls,ID,"1401 Poplar Ave, Twin Falls, ID 83301-6652, United States - ",18:00:00,6,2018-08-08T18:00:00-0600,https://www.facebook.com/events/656890204669715/,Door Knocking in Twin Falls with Aaron Swisher,https://www.facebook.com/SwisherforIdaho/,8/8/2018
,,,sb,EG,SA,Delete,Community Canvass with Linda Sarsour and Rep. Abdullah Hammoud,"This Saturday we're kicking off a HUGE community canvass to get out the vote for Abdul El-Sayed! Join us, Linda Sarsour, and Rep. Abdullah Hammoud as we take to the doors!

We have three shifts throughout the day! Find the time that works best for you.

Shift 1: 11 - 2:00 pm 
RSVP: https://go.abdulformichigan.com/event/action-attend/2292 

Shift 2: 2 - 5:00 pm
RSVP: https://go.abdulformichigan.com/event/action-attend/2293

Shift 3: 5 - 9:00 pm 
RSVP: https://go.abdulformichigan.com/event/action-attend/2294

Remember, we do this work together — so bring out your friends, family, and neighbors! We look forward to seeing you there!",,Detroit,MI,"4612 Lonyo St, Detroit, MI 48210-2105, United States - ",11:00:00,4,2018-08-04T11:00:00-0400,https://www.facebook.com/events/239814399974248/,Community Canvass with Linda Sarsour and Rep. Abdullah Hammoud,https://www.facebook.com/AbdulforMichigan/,8/4/2018
,,,sb,EG,SA,Delete,Volunteer with Grandpa Jan and Grandma Judy -Ann Arbor,"Come join Grandpa Jan and Grandma Judy as we Get Out The Vote for Abdul! We have less than a week to make history! Come meet the family and make some calls and knock some doorsfor Abdul! Make sure to bring a laptop if you are going to make calls

RSVP to phonebank: https://go.abdulformichigan.com/event/action/2473?source=map&akid= 

RSVP to knock doors: https://go.abdulformichigan.com/event/action/2251?source=map&akid=

NOTE: This is an event without Abdul.",,Ann Arbor,MI,"528 Virginia Ave, Ann Arbor, MI 48103-4138, United States - ",11:00:00,4,2018-08-04T11:00:00-0400,https://www.facebook.com/events/2165618683707330/,Volunteer with Grandpa Jan and Grandma Judy -Ann Arbor,https://www.facebook.com/AbdulforMichigan/,8/4/2018
,,,sb,EG,SA,Delete,8/5 - Voter Registration Drive,"Let's send Alexandria Ocasio-Cortez to Congress on November 6, 2018! We are actively seeking volunteers to help lead voter registration drives in NY14. Our goal is to sign up and help motivate as many new voters to participate in this year's general election. Come stop by with any questions, sign up to volunteer, and just say hello. Join the movement today!

If you have any questions, please email Shaniyat Chowdhury at shan@ocasio2018.com. If you'd like to volunteer to help out, DM the host, Ananya Kumar-Banerjee.",,,,34th Ave and 79th-80th Street -,8:00:00,4,2018-08-05T08:00:00-0400,https://www.facebook.com/events/589588308104231/,8/5 - Voter Registration Drive,https://www.facebook.com/Ocasio2018/,8/5/2018
,,,sb,EG,SA,Delete,8/6 - Voter Registration Drive (Elmhurst),"Let's send Alexandria Ocasio-Cortez to Congress on November 6, 2018! We are actively seeking volunteers to help lead voter registration drives in NY14. Our goal is to sign up and help motivate as many new voters to participate in this year's general election. Come stop by with any questions, sign up to volunteer, and just say hello. Join the movement today!

If you have any questions, please email Shaniyat Chowdhury at shan@ocasio2018.com. If you'd like to volunteer to help out, DM the host, Ananya Kumar-Banerjee.",,,,41st Ave 80th-81st Street -,12:00:00,4,2018-08-06T12:00:00-0400,https://www.facebook.com/events/267627417157797/,8/6 - Voter Registration Drive (Elmhurst),https://www.facebook.com/Ocasio2018/,8/6/2018
,,,sb,EG,SA,Delete,8/6 - Voter Registration Drive (Queens Office),"Let's send Alexandria Ocasio-Cortez to Congress on November 6, 2018! We are actively seeking volunteers to help lead voter registration drives in NY14. Our goal is to sign up and help motivate as many new voters to participate in this year's general election. Come stop by with any questions, sign up to volunteer, and just say hello. Join the movement today!

If you have any questions, please email Shaniyat Chowdhury at shan@ocasio2018.com. If you'd like to volunteer to help out, DM the host, Ananya Kumar-Banerjee.",,,,Parkchester Subway Stop -,17:00:00,4,2018-08-06T17:00:00-0400,https://www.facebook.com/events/287101715177568/,8/6 - Voter Registration Drive (Queens Office),https://www.facebook.com/Ocasio2018/,8/6/2018
,,,sb,EG,SA,Delete,8/6 - Voter Registration Drive (Jackson Heights),"Let's send Alexandria Ocasio-Cortez to Congress on November 6, 2018! We are actively seeking volunteers to help lead voter registration drives in NY14. Our goal is to sign up and help motivate as many new voters to participate in this year's general election. Come stop by with any questions, sign up to volunteer, and just say hello. Join the movement today!

If you have any questions, please email Shaniyat Chowdhury at shan@ocasio2018.com. If you'd like to volunteer to help out, DM the host, Ananya Kumar-Banerjee.",,,,37th Ave. 74th-75th Street -,17:00:00,4,2018-08-06T17:00:00-0400,https://www.facebook.com/events/461473394369446/,8/6 - Voter Registration Drive (Jackson Heights),https://www.facebook.com/Ocasio2018/,8/6/2018
,,,sb,EG,SA,Delete,8/6 - Voter Registration Drive (Woodside),"Let's send Alexandria Ocasio-Cortez to Congress on November 6, 2018! We are actively seeking volunteers to help lead voter registration drives in NY14. Our goal is to sign up and help motivate as many new voters to participate in this year's general election. Come stop by with any questions, sign up to volunteer, and just say hello. Join the movement today!

If you have any questions, please email Shaniyat Chowdhury at shan@ocasio2018.com. If you'd like to volunteer to help out, DM the host, Ananya Kumar-Banerjee.",,,,61st Street Roosevelt Ave. -,17:00:00,4,2018-08-06T17:00:00-0400,https://www.facebook.com/events/640589656309343/,8/6 - Voter Registration Drive (Woodside),https://www.facebook.com/Ocasio2018/,8/6/2018
,,,sb,EG,SA,Delete,8/6 - Voter Registration Drive (Queens Office),"Let's send Alexandria Ocasio-Cortez to Congress on November 6, 2018! We are actively seeking volunteers to help lead voter registration drives in NY14. Our goal is to sign up and help motivate as many new voters to participate in this year's general election. Come stop by with any questions, sign up to volunteer, and just say hello. Join the movement today!

If you have any questions, please email Shaniyat Chowdhury at shan@ocasio2018.com. If you'd like to volunteer to help out, DM the host, Ananya Kumar-Banerjee.",,,,40-08 Case St. 2nd floor -,17:00:00,4,2018-08-06T17:00:00-0400,https://www.facebook.com/events/2007868902877223/,8/6 - Voter Registration Drive (Queens Office),https://www.facebook.com/Ocasio2018/,8/6/2018
,,,sb,EG,SA,Delete,Lit Drop With Me,"Join us for a lit drop party this Saturday! We'll be meeting at the Anchorage campaign office in Spenard at 10:30am. Our Field Director, Sarra, will give us direction and set us off.
Early voting starts in less than a week- let's get out there!

Saturday, August 4th
1412 W 33rd Avenue Anchorage
10:30am-12:30pm",,,,"1412 W 33rd Ave, Anchorage, AK 99503-3637, United States - ",10:30:00,8,2018-08-04T10:30:00-0800,https://www.facebook.com/events/240052533306458/,Lit Drop With Me,https://www.facebook.com/alyse4alaska/,8/4/2018
,,,sb,EG,SA,Delete,Canvass in Lakeland 8/4,"We are knocking on doors in Lakeland this Saturday!
Ballots are being sent out so we need all hands on deck to get our Navy Veteran elected.
We need all our neighbors to know why we are supporting Andrew Learned before they fill out their ballots. 

Meet in the dining area of the Lake Miriam Square Publix to get your turf and lit.  Training provided- first time canvassers welcome and encouraged",,,,"Publix Super Market at Lake Miriam Square - Lakeland, FL",12:00:00,4,2018-08-04T12:00:00-0400,https://www.facebook.com/events/524240368033924/,Canvass in Lakeland 8/4,https://www.facebook.com/AndrewLearned/,8/4/2018
,,,sb,EG,SA,Delete,Canvass in Temple Terrace 8/5,"Get ready Temple Terrace! The Andrew Learned campaign is hitting your streets this weekend. This is one of the most important weekends for this historic election. Now is the time to get involved. Help us knock on doors and tell our neighbors why we are supporting Andrew Learned. Ballots have been sent out, so we must talk to them now!

Meet in the Dunkin Donuts on Fowler near 56th St to get your turf and lit. Training provided- first time canvassers welcome and encouraged",,,,"5610 E Fowler Ave, Temple Terrace, FL 33617-2308, United States - ",17:00:00,4,2018-08-05T17:00:00-0400,https://www.facebook.com/events/216317425733007/,Canvass in Temple Terrace 8/5,https://www.facebook.com/AndrewLearned/,8/5/2018
,,,sb,EG,SA,Delete,Phone Bank in Lakeland,We need to call everyone with a Vote by Mail Ballot! Help us talk to voters about Andrew Learned!,,,,"5718 Scott Lake Hills Ln, Lakeland, FL 33813-3235, United States - ",18:00:00,4,2018-08-06T18:00:00-0400,https://www.facebook.com/events/985118151668774/,Phone Bank in Lakeland,https://www.facebook.com/AndrewLearned/,8/6/2018
,,,sb,EG,SA,Delete,Bowling with Andy Kim,"Join us for a night of bowling to support:
Andy Kim
Democratic Congressional Candidate for New Jersey's 3rd District 
Challenging 'Trumpcare' Author Tom MacArthur

Your donation to the campaign gets you two hours of bowling and refreshments! You'll also have the opportunity to register to vote, request an absentee ballot (which can be sent to your campus), and sign up to volunteer with the campaign. 

We hope to see you there! Make sure to bring along friends and families—all are welcome!",,,,"Laurel Lanes - Maple Shade, NJ",18:00:00,4,2018-08-09T18:00:00-0400,https://www.facebook.com/events/1626107797514789/,Bowling with Andy Kim,https://www.facebook.com/AndyKimNJ/,8/9/2018
,,,sb,EG,ykh,Delete,Election Night Watch Party,"Our team of staff and volunteers have worked tremendously hard over the last several months to spread Andy’s progressive message throughout the 9th Congressional District! 

Join us at our election night watch party to celebrate our hard work, and to thank the voters of our campaign!",,,,"Rogers Roost - Sterling Heights, MI",20:00:00,4,2018-08-07T20:00:00-0400,https://www.facebook.com/events/1052808381565186/,Election Night Watch Party,https://www.facebook.com/AndyLevinForCongress/,8/7/2018
,,,sb,EG,ykh,Delete,Weekend of Action: Saturday Bloomington Phone Bank,"Next weekend, August 11 & 12, is our Weekend of Action across the district! Join us in Bloomington on Saturday to make phone calls in McLean County for Betsy! #TeamBetsy",,,,"McLean County Democrats HQ 801 W Washington St Bloomington, IL 61701 - ",9:00:00,5,2018-08-11T09:00:00-0500,https://www.facebook.com/events/271492846970113/,Weekend of Action: Saturday Bloomington Phone Bank,https://www.facebook.com/BetsyDirksenLondrigan/,8/11/2018
,,,sb,EG,ykh,Delete,Weekend of Action: Saturday Monticello Phone Bank,"Next weekend, August 11 & 12, is our Weekend of Action across the district! Join us in Monticello on Saturday to make phone calls in Piatt County for Betsy! #TeamBetsy",,,,"Hardee's - Monticello, IL",17:00:00,5,2018-08-11T17:00:00-0500,https://www.facebook.com/events/1497725993706711/,Weekend of Action: Saturday Monticello Phone Bank,https://www.facebook.com/BetsyDirksenLondrigan/,8/11/2018
,,,sb,EG,ykh,Delete,St. Paul Lawn Sign Launch,"Do you have a free hour on Sunday, August 5th? Do you have a car or access to one? Do you have the desire to support Betty McCollum's re-election to Congress? Good! Stop by the office at noon to grab a route and a few signs to put up and we'll send you on your way. (Pairing up is encouraged but not necessary.)

Please email Ian@mccollumforcongress.com to RSVP.",,,,"661 La Salle St, St Paul, MN 55114-1805, United States - ",12:00:00,5,2018-08-05T12:00:00-0500,https://www.facebook.com/events/1885236141776733/,St. Paul Lawn Sign Launch,https://www.facebook.com/betty.mccollum1/,8/5/2018
,,,sb,EG,ykh,Delete,Primary Election Day - Vote Wild on August 7th,"Join the WILD team today! Click the link to the official Bill Wild for Congress page and join our team. Our volunteers will play a crucial role as we work towards the primary election on August 7th, 2018. We will need your help! Click the link, sign up, and help us send Mayor Bill Wild to Washington. #WildForThe13th http://www.billwildforcongress.com/",,,,13th Congressional District -,7:00:00,4,2018-08-07T07:00:00-0400,https://www.facebook.com/events/406333063179459/,Primary Election Day - Vote Wild on August 7th,https://www.facebook.com/BillWild4Congress/,8/7/2018
,,,sb,EG,ykh,Delete,Promote the Vote,Join Cathy's campaign as we help Promote the Vote in Michigan!,,,,"Festival Market Square - Battle Creek, MI",17:00:00,4,2018-08-04T17:00:00-0400,https://www.facebook.com/events/1124119731059654/,Promote the Vote,https://www.facebook.com/cathyalbroforcongress/,8/4/2018
,,,sb,EG,ykh,Delete,GOTV Canvass for Cathy Myers in Kenosha!,"Join us on Saturday,  August 4th at the Home of Gwendolyn Skaggs to help elect Cathy Myers! Shifts are at 10am, 12pm, 2pm, and 4pm.  We need all hands on deck (and knocking doors) as we are in the final stretch before the August 14th primary!

If you have any questions, would like to knock on doors in your neighborhood or cannot physically canvass but would like to help in another way, just let us know in the comments or email our Kenosha organizer, Krish, at krish@cathymyersforcongress.com

Cathy is a 24-year veteran high school teacher who has served on the Janesville School Board since 2013. She’s running to strengthen public education and protect our schools from gun violence by enacting commonsense gun safety reforms. She’s also a single mom who understands the struggles working families face, that’s why she’s fighting for Medicare for All so everyone has access to the healthcare they need, to guarantee affordable childcare, and to raise the minimum wage to $15 an hour. 

If you can't make it on Saturday, but would like to volunteer with Cathy Myers, email Krish@cathymyersforcongress.com or sign up here: https://cathymyersforcongress.com/volunteer-with-team-cathy/",,,,"7300 7th Ave, Kenosha, WI 53143-5556, United States - ",10:00:00,5,2018-08-04T10:00:00-0500,https://www.facebook.com/events/291092241642425/,GOTV Canvass for Cathy Myers in Kenosha!,https://www.facebook.com/cathymyersforcongress/,8/4/2018
,,,sb,EG,ykh,Delete,GOTV Canvass for Cathy Myers in Kenosha!,"Join us on Saturday,  August 4th at the Home of Gwendolyn Skaggs to help elect Cathy Myers! Shifts are at 12pm, 2pm, and 4pm.  We need all hands on deck (and knocking doors) as we are in the final stretch before the August 14th primary!

If you have any questions, would like to knock on doors in your neighborhood, or cannot physically canvass but would like to help in another way, just let us know in the comments or email our Kenosha organizer, Krish, at krish@cathymyersforcongress.com

Cathy is a 24-year veteran high school teacher who has served on the Janesville School Board since 2013. She’s running to strengthen public education and protect our schools from gun violence by enacting commonsense gun safety reforms. She’s also a single mom who understands the struggles working families face, that’s why she’s fighting for Medicare for All so everyone has access to the healthcare they need, to guarantee affordable childcare, and to raise the minimum wage to $15 an hour. 

If you can't make it on Saturday, but would like to volunteer with Cathy Myers, email Krish@cathymyersforcongress.com or sign up here: https://cathymyersforcongress.com/volunteer-with-team-cathy/",,,,"7300 7th Ave, Kenosha, WI 53143-5556, United States - ",12:00:00,5,2018-08-05T12:00:00-0500,https://www.facebook.com/events/2181411121898832/,GOTV Canvass for Cathy Myers in Kenosha!,https://www.facebook.com/cathymyersforcongress/,8/5/2018
,,,sb,EG,ykh,Delete,Day of Action - Orlando,"The Primary Election is on August 28th, so we're knocking doors, making phone calls, and sending text messages to build support for Chris and Get Out the Vote!

If this is your first time volunteering with the campaign, don't worry! You will receive all the resources you need to knock doors, make calls, and send texts to registered voters. Be sure to bring a friend!

RSVP: https://secure.ngpvan.com/G32eufpZAUi_bED6RMaKrw2

For more information: tmartin@chriskingforflorida.com

Can't join us for this event, but still want to support Chris?

Join #TeamKing:
https://www.chriskingforflorida.com/get-involved/
Twitter: https://twitter.com/ChrisKingFL
Instagram: https://www.instagram.com/chriskingfl/",,,,"1612 E Colonial Dr, Orlando, FL 32803-4804, United States - ",15:00:00,4,2018-08-11T15:00:00-0400,https://www.facebook.com/events/480784245755195/,Day of Action - Orlando,https://www.facebook.com/ChrisKingFL/,8/11/2018
,,,sb,ykh,EG,Delete,Saline County Canvass/ Phone Bank,"Join Team Tucker  as we knock on doors to let voters know about Clarke Tucker and the many reasons to vote this November!

We will meet at the Democratic Party of Saline County headquarters at 9:45 am. 

Never canvassed before? No worries, as we will provide training  and send you out with a partner.

If you can come for even half an hour, your work will make a difference.",,,,"Democratic Party of Saline County - Benton, AR",10:00:00,5,2018-08-04T10:00:00-0500,https://www.facebook.com/events/273022173287277/,Saline County Canvass/ Phone Bank,https://www.facebook.com/TuckerForCongress/,8/4/2018
,,,sb,ykh,EG,Delete,Clarke Tucker for Congress Phone Bank,"Stop by our headquarters after work to help us talk to voters all over the district! We will be set up for 2 hours, but please stop by for any amount of time you are available. Food will be provided.",,,,"7509 Cantrell Road, Suite 211, Little Rock, AR 72207 - ",17:30:00,5,2018-08-09T17:30:00-0500,https://www.facebook.com/events/2150721321873780/,Clarke Tucker for Congress Phone Bank,https://www.facebook.com/TuckerForCongress/,8/9/2018
,,,sb,ykh,EG,Delete,Saturday Day of Action,"This weekend we have 2 Days of Action for our field campaign. A big crowd will gather at the Target in Fultondale, get walk packets, then head out to knock doors. There will be plenty of training for first timers. But if you have experience canvassing, you can pick up your packet and go!

In addition to these big Days of Action, we welcome people to come by the office any day, any time to volunteer. There are tens of thousands of doors to knock!",,,,"Target Store Fultondale - Fultondale, AL",10:00:00,5,2018-08-04T10:00:00-0500,https://www.facebook.com/events/254621995353921/,Saturday Day of Action,https://www.facebook.com/VoteDannerKline/,8/4/2018
,,,sb,ykh,EG,Delete,Sunday Day of Action,"This weekend we have 2 Days of Action for our field campaign. A big crowd will gather at the Target in Fultondale, get walk packets, then head out to knock doors. There will be plenty of training for first timers. But if you have experience canvassing, you can pick up your packet and go!

In addition to these big Days of Action, we welcome people to come by the office any day, any time to volunteer. There are tens of thousands of doors to knock!",,,,"Target Store Fultondale - Fultondale, AL",14:00:00,5,2018-08-05T14:00:00-0500,https://www.facebook.com/events/1866266183457917/,Sunday Day of Action,https://www.facebook.com/VoteDannerKline/,8/5/2018
,,,sb,ykh,EG,Delete,Phonebank with State Representative David Richardson,"Join us for a phonebank in support of David Richardson and help us earn votes that will lead us to victory on August 28th.

Richardson made history when he was first elected to the Florida House of Representatives in 2012 with the support of SAVE, becoming the first openly gay state representative in Florida. For the past three years, he has been fighting in Tallahassee to protect LGBTQ youth from the dangerous and fraudulent practice of conversion therapy. 

RSVP at http://www.save.lgbt/richardson_phonebank",,,,"CIC Miami - Miami, FL",17:00:00,4,2018-08-09T17:00:00-0400,https://www.facebook.com/events/272479053531440/,Phonebank with State Representative David Richardson,https://www.facebook.com/DavidRichardsonFL/,8/9/2018
,,,sb,ykh,EG,Delete,Canvass in Support of David Richardson for Congress,"Join us to knock on doors in your neighborhood for David Richardson and help us earn votes that will lead us to victory on August 28th.

Richardson made history when he was first elected to the Florida House of Representatives in 2012 with the support of SAVE, becoming the first openly gay state representative in Florida. For the past three years, he has been fighting in Tallahassee to protect LGBTQ youth from the dangerous and fraudulent practice of conversion therapy. 

RSVP at http://www.save.lgbt/richardson_canvass_20180818",,,,"336 NW 12th Ave, Miami, FL 33128-1019, United States - ",10:00:00,4,2018-08-18T10:00:00-0400,https://www.facebook.com/events/302495820324846/,Canvass in Support of David Richardson for Congress,https://www.facebook.com/DavidRichardsonFL/,8/18/2018
,,,sb,ykh,EG,Delete,Bloomington Lawn Sign Pick-Up & Early Vote,"Come visit the Government Repair Shack in the Group Travel Directors Parking Lot in Bloomington and while you're here, pick up lawn signs, get merchandise, and vote early! 

Questions? Post here on the event or send us a message!
#EveryonesInvited #DeanTeam",,,,"Group Travel Directors - Accolades International Tours for the Arts - Minneapolis, MN",10:00:00,5,2018-08-04T10:00:00-0500,https://www.facebook.com/events/428535387652790/,Bloomington Lawn Sign Pick-Up & Early Vote,https://www.facebook.com/deanphillipsforcongress/,8/4/2018
,,,sb,ykh,EG,Delete,Smith Coffee — Lawn Signs & Early Vote,"Come visit the Government Repair Shack in the parking lot of Smith Coffee and Cafe in Eden Prairie and while you're here, pick up lawn signs, get merchandise, and vote early! 

Questions? Post here on the event or send us a message!
#EveryonesInvited #DeanTeam",,,,"Smith Eden Prairie - Eden Prairie, MN",13:00:00,5,2018-08-12T13:00:00-0500,https://www.facebook.com/events/662633177445103/,Smith Coffee — Lawn Signs & Early Vote,https://www.facebook.com/deanphillipsforcongress/,8/12/2018
,,,sb,ykh,EG,Delete,Mesa County Volunteer Kickoff,"The early volunteer gets the vote! 

Please join Team Diane in Grand Junction for our Mesa Volunteer Kickoff. We're building an amazing ground game and that starts with creating local volunteer teams. We'll spend some time strategizing before we break out to canvass, phone bank, write letters to the editor, stuff envelops, and more!

There are so many ways to get involved and there's a perfect task for everyone. It takes a village to flip a district, so we need all the help we can get!

Meet at our new headquarters, 241 Grand Ave!",,,,"Grand Junction, CO - Grand Junction, CO",9:30:00,6,2018-08-04T09:30:00-0600,https://www.facebook.com/events/408756839648536/,Mesa County Volunteer Kickoff,https://www.facebook.com/RepDMB/,8/4/2018
,,,sb,ykh,EG,Delete,GOTV Office Party & Canvass,"Join us Sunday 8/5 at our Warren Field Office for drinks, snacks and an afternoon canvass with Ellen to Get Out the Vote.",,,,14156 E 12 Mile Rd -,12:00:00,4,2018-08-05T12:00:00-0400,https://www.facebook.com/events/738554479821315/,GOTV Office Party & Canvass,https://www.facebook.com/EllenLiptonforCongress/,8/5/2018
,,,sb,ykh,EG,Delete,Burnsville Door Knock,"We are less than 2 weeks away from the Primary! Now is the time to take action. Join Team Erin to knock doors in Burnsville. We'll meet nearby at the Apple Valley DFL HQ at 10am. This will allow us to have a space to train, and in the case of thunderstorms, we'll make phone calls instead.

 *There is a parking lot behind the building. You can find us on the second floor in Suite 215. Call or text CD 2 organizer, Jillian Carpenter, (218) 349-9300 with any questions or to RSVP.",,,,"15322 Galaxie Ave W, Apple Valley, MN 55124-3148, United States - ",9:00:00,5,2018-08-04T09:00:00-0500,https://www.facebook.com/events/255845458573889/,Burnsville Door Knock,https://www.facebook.com/epmurphymn%20/,8/4/2018
,,,sb,ykh,EG,Delete,Doorknocking in Rochester,Join us at the Rochester DFL office for a door knock for Erin Murphy! We will be meeting at the office at 10 AM.,,,,"1500 1st Ave NE, Rochester, MN 55906-4107, United States - ",10:00:00,5,2018-08-04T10:00:00-0500,https://www.facebook.com/events/410789259442533/,Doorknocking in Rochester,https://www.facebook.com/epmurphymn%20/,8/4/2018
,,,sb,ykh,EG,Delete,Mankato Door Knock,Join us for a door knock in Mankato this Saturday held in the SD 19 DFL office! We will be kicking the event off at 10 AM. Contact campaign organizer Maddie Pavek maddiep@murphyformn.com to RSVP or with questions.,,,,"110 E Liberty St, Mankato, MN 56001-3851, United States - ",10:00:00,5,2018-08-04T10:00:00-0500,https://www.facebook.com/events/2210708975817798/,Mankato Door Knock,https://www.facebook.com/epmurphymn%20/,8/4/2018
,,,sb,ykh,EG,Delete,Northfield Door Knock,Join us for a door knock at the DFL office in Northfield this Saturday! We will be meeting at noon. Contact organizer Maddie Pavek (maddiep@murphyformn.com) to RSVP or with questions!,,,,"108 Highway 3 S, Northfield, MN 55057, United States - ",12:00:00,5,2018-08-05T12:00:00-0500,https://www.facebook.com/events/235041527143211/,Northfield Door Knock,https://www.facebook.com/epmurphymn%20/,8/5/2018
