K1,K2,K3,D1,D2,D3,,,,Additional,City,State,,Start Time,Time Zone,,,,,
,,,sb,,,,Canvass with Team Mike!,"Join Team Mike at any of our 3 offices as we canvass neighborhoods around our district to talk about Mike Levin!

𝗣𝗹𝗲𝗮𝘀𝗲 𝗦𝗶𝗴𝗻 𝗨𝗽 𝗛𝗲𝗿𝗲

Oceanside: events.mobilizeamerica.io/levinforcongress/event/7358/
San Clemente: events.mobilizeamerica.io/levinforcongress/event/7361/
Solana Beach: events.mobilizeamerica.io/levinforcongress/event/7357/",,,,"Mike Levin - Oceanside, CA",12:30:00,7,2018-08-25T12:30:00-0700,https://www.facebook.com/events/424340718071801/,Canvass with Team Mike!,https://www.facebook.com/LevinforCongress/,8/25/2018
sb,,,,,,,UAW Canvass with Randy!,"Come and canvass with UAW members and Randy Bryce on Saturday!

Randy Bryce, John Drew, and Tod Ohnstad will be kicking off our canvass!

We're just a week out from the start of Get Out the Vote, and we're all hands on deck to win this! Come by and knock some doors or make some calls.",,,,"408 S Main St, Racine, WI 53403-1031, United States - ",10:00:00,5,2018-08-04T10:00:00-0500,https://www.facebook.com/events/322648288279059/,UAW Canvass with Randy!,https://www.facebook.com/RandyBryce2018/,8/4/2018
,,,sb,,,,North Valley Canvass,"Volunteering for Steve Farley for Governor and Julie Gunnigle for LD 15 Rep.

For more info: email kurt@farleyforarizona.com",,,,"Saddlecreek Coffee Company - Cave Creek, AZ",9:00:00,7,2018-08-11T09:00:00-0700,https://www.facebook.com/events/262171564390551/,North Valley Canvass,https://www.facebook.com/FarleyforAZ/,8/11/2018
sb,,,,,,,Join Susan to Canvass in Summit County!,"Please join Susan in person tomorrow, Sat, Aug 4, to door knock voters in the 16th Congressional District! We'll meet at the Democratic headquarters in downtown Akron.",,,,"733 W Market St, Akron, OH 44303-1050, United States - ",10:00:00,4,2018-08-04T10:00:00-0400,https://www.facebook.com/events/264621524319140/,Join Susan to Canvass in Summit County!,https://www.facebook.com/SusanPalmerOH/,8/4/2018
,,,sb,,,,Indivisible Manteca & Manteca Dems Canvass for Josh Harder,"Join us and the Manteca Democratic Club to canvass for Josh Harder so that we can elect him to represent CA-10 in Congress!  Launch times are 10:00AM,  1:00PM and 4:00PM. 

In order to prepare for the weather, please bring your own cold water bottle, sunscreen, a hat, and comfortable shoes.",,,,"Ripon, CA - Ripon, CA",10:00:00,7,2018-08-04T10:00:00-0700,https://www.facebook.com/events/1912152609077571/,Indivisible Manteca & Manteca Dems Canvass for Josh Harder,https://www.facebook.com/harderforcongress/,8/4/2018
,,,sb,,,,Indivisible Manteca & Manteca Dems Canvass for Josh Harder,"Join us and the Manteca Democratic Club to canvass for Josh Harder so that we can elect him to represent CA-10 in Congress!  Launch times are 10:00AM,  1:00PM and 4:00PM. 

In order to prepare for the weather, please bring your own cold water bottle, sunscreen, a hat, and comfortable shoes.",,,,"Ripon, CA - Ripon, CA",10:00:00,7,2018-08-04T10:00:00-0700,https://www.facebook.com/events/1912152609077571/,Indivisible Manteca & Manteca Dems Canvass for Josh Harder,https://www.facebook.com/harderforcongress/,8/4/2018
,,,sb,,,,Redmond Get Out The Vote Canvassing Event,"Join us at our campaign office on Sunday, August 5th for a canvassing event to protect the majority in Olympia!

Please arrive at 9:45 am so the speaking program can start promptly at 10 am.

Governor Jay Inslee, US Senator Cantwell, Congresswoman Suzan DelBene, State Senator Patty Kuderer, and State Senator Manka Dhingra will be speaking at the canvass launch!

To RSVP, please go to: http://bit.ly/letswin18",,,,"8151 164th Ave NE, Redmond, WA 98052-3817, United States - ",9:45:00,7,2018-08-05T09:45:00-0700,https://www.facebook.com/events/2106983382894042/,Redmond Get Out The Vote Canvassing Event,https://www.facebook.com/mariacantwell/,8/5/2018
ykh,,,sb,,,,Shawnee Day of Action,"Head's up, y'all: Team Kendra's coming to Shawnee! We're so excited - come meet Kendra, and then help us talk to voters in Shawnee. We need both canvassers and drivers, so come help us #FlipThe5th - Shawnee style!

OKC friends: Want to come with us? We'll be meeting at our office (5001 N Penn Ave, suite 201) at 9:00 and carpooling out to Pottawatomie County.",,,,"The Gathering Place - Shawnee, OK",10:00:00,5,2018-08-04T10:00:00-0500,https://www.facebook.com/events/445153879293800/,Shawnee Day of Action,https://www.facebook.com/KendraHornForCongress/,8/4/2018
sb,,,,,,,Soderberg for Congress Canvass Kick Off!,"Join us this Saturday at 11AM to knock on doors with Nancy Soderberg!

With less than 30 days until the Election, we need to talk to our neighbors now and make sure they are ready to vote!

Location: 1200 Deltona Blvd, Suite 6-8, Deltona

RSVP to canvass with us by emailing: kirsten@soderbergforcongress.com",,,,"1200 Deltona Blvd, Suite 6-8, Deltona, FL - ",11:00:00,4,2018-08-04T11:00:00-0400,https://www.facebook.com/events/1652652078196411/,Soderberg for Congress Canvass Kick Off!,https://www.facebook.com/SoderbergforCongress/,8/4/2018
,,,sb,,,,Team Schrier Wenatchee Canvass,"Join Team Kim to knock on doors in Wenatchee. We'll be talking to voters about the issues that matter most about them and spreading the word about why we know Dr. Kim Schrier is the best candidate to represent the 8th District in Congress! 

First-time canvassers are encouraged to join! Training will be provided. 

Sign up using the RSVP link or email info@drkimschrier.com for more information.",,,,"Memorial Park Wenatchee-2 S Chelan Ave, Wenatchee, WA 98801 - ",10:00:00,7,2018-08-04T10:00:00-0700,https://www.facebook.com/events/247985629327051/,Team Schrier Wenatchee Canvass,https://www.facebook.com/DrKimSchrier/,8/4/2018
,,,sb,,,,Volunteer Training: Canvassing,"Face-to-face contact is still one of the most effective ways of reaching voters! Sponsored by the NY Democratic Party, this workshop will teach you how to overcome ""stage fright"" and do door-to-door canvassing. Register at https://events.mobilizeamerica.io/nydems/event/5231/",,,,"Mayville, NY - Mayville, NY",16:00:00,4,2018-08-04T16:00:00-0400,https://www.facebook.com/events/505826933198635/,Volunteer Training: Canvassing,https://www.facebook.com/tracymitranoNY23/,8/4/2018
,,,sb,,,,Volunteer Training: Phone banking,Learn how to make calls to local voters and encourage them to vote for Tracy! Register at https://secure.ngpvan.com/4_dWx1dp30Kx-yEgIK2ERQ2,,,,"Corning, NY - ",17:00:00,4,2018-08-05T17:00:00-0400,https://www.facebook.com/events/400001330526233/,Volunteer Training: Phone banking,https://www.facebook.com/tracymitranoNY23/,8/5/2018
,,,sb,,,,"Volunteer Training: Phone Banking, canvassing","Training on how to make phone calls, go door to door, and make sure Tracy wins in November! Register at https://secure.ngpvan.com/daJtEkBWNUKqS4zPxqu5-g2",,,,"Watkins Glen Public Library - Watkins Glen, NY",12:00:00,4,2018-08-04T12:00:00-0400,https://www.facebook.com/events/264938510904161/,"Volunteer Training: Phone Banking, canvassing",https://www.facebook.com/tracymitranoNY23/,8/4/2018
,,,sb,,,,"Volunteer Training: Phone banking, canvassing","Learn how to make phone calls, canvass, and make sure Tracy wins this November! Register at https://secure.ngpvan.com/Z7wMFGvCM0WBikUEO9kkOw2",,,,"Ithaca, NY - Ithaca, NY",12:00:00,4,2018-08-05T12:00:00-0400,https://www.facebook.com/events/427799554395993/,"Volunteer Training: Phone banking, canvassing",https://www.facebook.com/tracymitranoNY23/,8/5/2018
,,,sb,,,,"Volunteer Training: Phone banking, canvassing","Learn how to make phone calls, knock on doors, and help get Tracy elected this November! Register at https://secure.ngpvan.com/SL_ar1csNkSayBZMLRwysg2",,,,"Trumansburg, NY - Trumansburg, NY",14:00:00,4,2018-08-05T14:00:00-0400,https://www.facebook.com/events/662346150799295/,"Volunteer Training: Phone banking, canvassing",https://www.facebook.com/tracymitranoNY23/,8/5/2018
,,,sb,,,,Westside SA Canvass for Gina Ortiz Jones,"Join #TeamGOJ for a canvass on the Westside of San Antonio, this Saturday, August 4th to get involved and make real change. We'll talk to our neighbors about issues that matter, get out the vote for Gina, and give voters important info for the November election. We'll also recruit more volunteers, round up lots of votes, and get more people engaged in the political process.

We'll be meeting at the Basketball Courts at the Heritage Duck Pond at 10am; so come on out and knock on some doors with us! Be sure to wear comfy walking shoes and bring water.",,,,"Heritage Duck Pond Park - San Antonio, TX",10:00:00,5,2018-08-04T10:00:00-0500,https://www.facebook.com/events/2199653923599761/,Westside SA Canvass for Gina Ortiz Jones,https://www.facebook.com/GinaOrtizJones/,8/4/2018
,,,sb,,,,Westside SA Canvass for Gina Ortiz Jones,"Join #TeamGOJ for a canvass on the Westside of San Antonio, this Saturday, August 4th to get involved and make real change. We'll talk to our neighbors about issues that matter, get out the vote for Gina, and give voters important info for the November election. We'll also recruit more volunteers, round up lots of votes, and get more people engaged in the political process.

We'll be meeting at the Basketball Courts at the Heritage Duck Pond at 10am; so come on out and knock on some doors with us! Be sure to wear comfy walking shoes and bring water.",,,,"Heritage Duck Pond Park - San Antonio, TX",10:00:00,5,2018-08-04T10:00:00-0500,https://www.facebook.com/events/2199653923599761/,Westside SA Canvass for Gina Ortiz Jones,https://www.facebook.com/GinaOrtizJones/,8/4/2018
,,,sb,,,,Whispering Oaks Canvass for Gina Ortiz Jones,"Join Team GOJ for a canvass on the Northside of San Antonio, this Sunday, August 5th to get involved and make real change. We'll talk to our neighbors about issues that matter, get out the vote for Gina, and give voters important info for the November election. We'll also recruit more volunteers, round up lots of votes, and get more people engaged in the political process.

We'll be meeting at the home of Darren Meritz at 10am; so come on out and knock on some doors with us! Be sure to wear comfy walking shoes and bring water.

If you have any questions, please contact our field organizer, Darren Meritz at dmeritz@ginaortizjones.com or (915) 274-2501",,,,"11405 Whisper Valley St, San Antonio, TX 78230-3733, United States - ",10:00:00,5,2018-08-05T10:00:00-0500,https://www.facebook.com/events/1076120125876073/,Whispering Oaks Canvass for Gina Ortiz Jones,https://www.facebook.com/GinaOrtizJones/,8/5/2018
,,,sb,,,,Whispering Oaks Canvass for Gina Ortiz Jones,"Join Team GOJ for a canvass on the Northside of San Antonio, this Sunday, August 5th to get involved and make real change. We'll talk to our neighbors about issues that matter, get out the vote for Gina, and give voters important info for the November election. We'll also recruit more volunteers, round up lots of votes, and get more people engaged in the political process.

We'll be meeting at the home of Darren Meritz at 10am; so come on out and knock on some doors with us! Be sure to wear comfy walking shoes and bring water.

If you have any questions, please contact our field organizer, Darren Meritz at dmeritz@ginaortizjones.com or (915) 274-2501",,,,"11405 Whisper Valley St, San Antonio, TX 78230-3733, United States - ",10:00:00,5,2018-08-05T10:00:00-0500,https://www.facebook.com/events/1076120125876073/,Whispering Oaks Canvass for Gina Ortiz Jones,https://www.facebook.com/GinaOrtizJones/,8/5/2018
,,,sb,,,,Canvass in Plymouth Township with Tim Greimel,"Knock doors with Tim Greimel in Plymouth Township!  Meet us at the local Kroger on the corner of Ann Arbor Road and Sheldon.  Help us Get Out The Vote in Plymouth!  

For more information, call Brittany at (248) 935-1518 or email brittany.pinnock@timgreimelforcongress.com.",,,,"44525 Ann Arbor Rd W, Plymouth, MI 48170 - ",13:00:00,4,2018-08-05T13:00:00-0400,https://www.facebook.com/events/200806667448218/,Canvass in Plymouth Township with Tim Greimel,https://www.facebook.com/tim.greimel.3/,8/5/2018
,,,sb,,,,Canvass Kickoff With Anthony Brindisi,Join us at Cortland Democratic Headquarters (129 Port Watson Street) to go out and knock on doors and talk to voters in the local area about electing Anthony Brindisi to Congress!,,,,"Cortland County Democratic Committee - Cortland, NY",10:00:00,4,2018-08-04T10:00:00-0400,https://www.facebook.com/events/231769634042533/,Canvass Kickoff With Anthony Brindisi,https://www.facebook.com/BrindisiForCongress/,8/4/2018
,,,sb,,,,Canvass Kickoff With Anthony Brindisi,Join us at Cortland Democratic Headquarters (129 Port Watson Street) to go out and knock on doors and talk to voters in the local area about electing Anthony Brindisi to Congress!,,,,"Cortland County Democratic Committee - Cortland, NY",10:00:00,4,2018-08-04T10:00:00-0400,https://www.facebook.com/events/231769634042533/,Canvass Kickoff With Anthony Brindisi,https://www.facebook.com/BrindisiForCongress/,8/4/2018
,,,sb,,,,"Canvass to support Kling, Kopser, & Zwiener in Buda!","We have a new block walking opportunity in Buda this weekend in Precinct 224. This is your chance to help our neighborhood connect with local candidates including Erin Zwiener for Texas House, Steven Kling for Texas Senate, and Joseph Kopser for US Congress. Our plan is to meet at Nate's around 9:30 AM, hold a quick training session and then split up. We have over 6,000 voters in Precinct 224 so this will be a great opportunity to help get the word out to our fellow neighbors. If you have not participated in a block walk before that's not a problem -we'll have volunteers on hand to help. Please feel free to reach out to Bert at bert.garza@gmail.com and Will at will@kopserforcongress.com regarding any questions.",,,,"Nate's - Buda, TX",9:30:00,5,2018-08-04T09:30:00-0500,https://www.facebook.com/events/248808525732437/,"Canvass to support Kling, Kopser, & Zwiener in Buda!",https://www.facebook.com/KopserforCongress/,8/4/2018
,,,sb,,,,"Canvass to support Kling, Kopser, & Zwiener in Buda!","We have a new block walking opportunity in Buda this weekend in Precinct 224. This is your chance to help our neighborhood connect with local candidates including Erin Zwiener for Texas House, Steven Kling for Texas Senate, and Joseph Kopser for US Congress. Our plan is to meet at Nate's around 9:30 AM, hold a quick training session and then split up. We have over 6,000 voters in Precinct 224 so this will be a great opportunity to help get the word out to our fellow neighbors. If you have not participated in a block walk before that's not a problem -we'll have volunteers on hand to help. Please feel free to reach out to Bert at bert.garza@gmail.com and Will at will@kopserforcongress.com regarding any questions.",,,,"Nate's - Buda, TX",9:30:00,5,2018-08-04T09:30:00-0500,https://www.facebook.com/events/248808525732437/,"Canvass to support Kling, Kopser, & Zwiener in Buda!",https://www.facebook.com/KopserforCongress/,8/4/2018
,,,sb,,,,Canvass with Team Jason in Sammamish!,Come knock doors with Team Jason in Sammamish the last weekend before the election!,,,,"Sammamish City Hall - Sammamish, WA",11:00:00,7,2018-08-05T11:00:00-0700,https://www.facebook.com/events/694386550903366/,Canvass with Team Jason in Sammamish!,https://www.facebook.com/JasonRittereiserforCongress/,8/5/2018
,,,sb,,,,Canvass with Team Jason!,Come knock doors for Jason in the final weekend before the primary! We need all hands on deck to make sure Jason gets a chance to take on Dino Rossi in the general!,,,,"411 E St NE, Auburn, WA 98002-4330, United States - ",10:00:00,7,2018-08-05T10:00:00-0700,https://www.facebook.com/events/186786295528796/,Canvass with Team Jason!,https://www.facebook.com/JasonRittereiserforCongress/,8/5/2018
,,,sb,,,,Comal County Canvass Launch!,"One of the best things you can do to get Joseph elected is to talk to voters face to face about TX21 and how important this race is. Join us for a few hours to knock doors and tell voters in Comal County about Joseph and the issues that we care about. We will provide materials and training, so just bring yourself (and a friend!).

We are launching from the Democratic Party HQ in New Braunfels at 1592 W. San Antonio St. at 10am. RSVP in the ticket link above or to Sara at sara@kopserforcongress.com!",,,,"1592 W San Antonio St, New Braunfels, TX 78130-6204, United States - ",10:00:00,5,2018-08-04T10:00:00-0500,https://www.facebook.com/events/517556962016392/,Comal County Canvass Launch!,https://www.facebook.com/KopserforCongress/,8/4/2018
,,,sb,,,,Comal County Canvass Launch!,"One of the best things you can do to get Joseph elected is to talk to voters face to face about TX21 and how important this race is. Join us for a few hours to knock doors and tell voters in Comal County about Joseph and the issues that we care about. We will provide materials and training, so just bring yourself (and a friend!).

We are launching from the Democratic Party HQ in New Braunfels at 1592 W. San Antonio St. at 10am. RSVP in the ticket link above or to Sara at sara@kopserforcongress.com!",,,,"1592 W San Antonio St, New Braunfels, TX 78130-6204, United States - ",10:00:00,5,2018-08-04T10:00:00-0500,https://www.facebook.com/events/517556962016392/,Comal County Canvass Launch!,https://www.facebook.com/KopserforCongress/,8/4/2018
,,,sb,,,,Dialing to Victory - Saturday,"Join us THIS Saturday, August 4th, for our Dialing to Victory Weekend. From 12-6 PM we will be providing soup & sandwiches while you help us dial to victory. Unite with other grassroots conservatives, and help ensure Jeff represents us in November.

RSVP here: http://www.johnsonforgovernor.org/dialing_to_victory_saturday",,,,"1710 Douglas Dr N, Suite 111, Minneapolis, MN 55422-4313, United States - ",12:00:00,5,2018-08-04T12:00:00-0500,https://www.facebook.com/events/1790421547739842/,Dialing to Victory - Saturday,https://www.facebook.com/jeff4gov/,8/4/2018
,,,sb,,,,Dialing to Victory - Sunday,"Join us THIS Sunday, August 5th, for our Dialing to Victory Weekend. From 12-6 PM we will be providing desserts while you help us dial to victory. Unite with other grassroots conservatives, and help ensure Jeff represents us in November.

RSVP here: http://www.johnsonforgovernor.org/dialing_to_victory_sunday",,,,"1710 Douglas Dr N, Suite 111, Minneapolis, MN 55422-4313, United States - ",12:00:00,5,2018-08-05T12:00:00-0500,https://www.facebook.com/events/1363117157155267/,Dialing to Victory - Sunday,https://www.facebook.com/jeff4gov/,8/5/2018
,,,sb,,,,"Door Knock for Erin Murphy, Tina Smith, and Ilhan Omar!","Join #TeamIlhan to connect with your neighbors about DFL endorsed candidates Ilhan Omar for MN-5, Erin Murphy for Governor, and Tina Smith for U.S. Senate.  We will be meeting at  Episcopal Church in MN

Training provided | Kid-friendly

Shifts 10-2 pm 12-4 pm , 2-6pm

Contact Name: Deonte Horton

Contact Phone: 915-202-4228

Contact Email: dhorton@dfl.org

Sign Up: https://secure.ngpvan.com/pBrVAsZC4kqCzlR4bOuxyg2

lhan is the DFL endorsed candidate for the 5th Congressional District. legislator, coalition builder, organizer, and a working mom. She is the highest ranking Somali-American, Muslim woman elected to a state legislature in the United States. 

Ilhan serves as the Assistant Minority Leader at the Minnesota Legislature. As a legislator, she's championed renters rights, advocated for juvenile justice reform, expanded access to affordable childcare, and fought to protect our refugee, immigrant, and undocumented neighbors.

Ilhan has been on the cover of TIME magazine, and has won awards for her dedicated work on immigration issues, education, and advancing entrepreneurship. Earlier this year she was recognized by Governor Dayton with the MLK Service Award for her work on civil rights. She lives in the West Bank neighborhood of Minneapolis with her husband and their three children.",,,,"1101 W Broadway Ave. Minneapolis, MN 55411 (Episcopal Church in MN) - ",10:00:00,5,2018-08-04T10:00:00-0500,https://www.facebook.com/events/243017966531301/,"Door Knock for Erin Murphy, Tina Smith, and Ilhan Omar!",https://www.facebook.com/IlhanMN/,8/4/2018
,,,sb,,,,"Door Knock for Erin Murphy, Tina Smith, and Ilhan Omar!","Join #TeamIlhan to connect with your neighbors about DFL endorsed candidates Ilhan Omar for MN-5, Erin Murphy for Governor, and Tina Smith for U.S. Senate. We'll be meeting in the Brookdale Library Conference Room.

Training provided | Kid-friendly

Shifts 10-2 pm  12-4 pm , 2-6pm

Contact Name: Talia Glass

Contact Phone: 651-764-6946

Contact Email: tglass@dfl.org

Sign up: https://secure.ngpvan.com/6dAz2Q5CJ0-ewXKQSUZrnw2

lhan is the DFL endorsed candidate for the 5th Congressional District. legislator, coalition builder, organizer, and a working mom. She is the highest ranking Somali-American, Muslim woman elected to a state legislature in the United States. 

Ilhan serves as the Assistant Minority Leader at the Minnesota Legislature. As a legislator, she's championed renters rights, advocated for juvenile justice reform, expanded access to affordable childcare, and fought to protect our refugee, immigrant, and undocumented neighbors.

Ilhan has been on the cover of TIME magazine, and has won awards for her dedicated work on immigration issues, education, and advancing entrepreneurship. Earlier this year she was recognized by Governor Dayton with the MLK Service Award for her work on civil rights. She lives in the West Bank neighborhood of Minneapolis with her husband and their three children.",,,,"4407 E Lake St. Minneapolis, MN 55406 (DFL Office South) - ",10:00:00,5,2018-08-04T10:00:00-0500,https://www.facebook.com/events/2208776772485637/,"Door Knock for Erin Murphy, Tina Smith, and Ilhan Omar!",https://www.facebook.com/IlhanMN/,8/4/2018
,,,sb,,,,Door Knock for Sen. Tina Smith,"Come talk to your neighbors about voting in the Primary on August 14th and why Senator Tina Smith, as well as the other DFL-endorsed candidates, will keep up the momentum she has built to continue fighting for all Minnesotans. No previous door knocking experience necessary! 🚪All ages are welcome. 

Email cjacket@dfl.org for the address to meet at.",,,,"Edina, MN - Edina, MN",12:00:00,5,2018-08-05T12:00:00-0500,https://www.facebook.com/events/294330234648371/,Door Knock for Sen. Tina Smith,https://www.facebook.com/TinaSmithMN/,8/5/2018
,,,sb,,,,Door Knock for Sen. Tina Smith & DFL Candidates,"Come talk to your neighbors about voting in the Primary on August 14th and why Senator Tina Smith, as well as Lori Ann (21A) and Jonathan Isenor (21B), will keep up the momentum she has built to continue fighting for all Minnesotans. No previous door knocking experience necessary! 🚪All ages are welcome.",,,,"1001 Main St, Red Wing, MN - ",13:00:00,5,2018-08-04T13:00:00-0500,https://www.facebook.com/events/447585319042873/,Door Knock for Sen. Tina Smith & DFL Candidates,https://www.facebook.com/TinaSmithMN/,8/4/2018
,,,sb,,,,Door Knock with Tabitha - Montgomery,"Come and talk to your neighbors! The Isner Campaign is hosting a Canvass Kick Off Event in Montgomery on Saturday, August 4 at Vaughn Park! Canvass shifts are 10-12 and 1-3. Lunch is served at 12 pm. Please RSVP here: https://secure.ngpvan.com/WP0jNe0qbU2U3ZhpiA5b7w2",,,,"Vaughn Road Park - Montgomery, AL",10:00:00,5,2018-08-04T10:00:00-0500,https://www.facebook.com/events/2231132303568802/,Door Knock with Tabitha - Montgomery,https://www.facebook.com/TabithaIsner/,8/4/2018
,,,sb,,,,Door Knock with Tabitha - Montgomery,"Come and talk to your neighbors! The Isner Campaign is hosting a Canvass Kick Off Event in Montgomery on Saturday, August 4 at Vaughn Park! Canvass shifts are 10-12 and 1-3. Lunch is served at 12 pm. Please RSVP here: https://secure.ngpvan.com/WP0jNe0qbU2U3ZhpiA5b7w2",,,,"Vaughn Road Park - Montgomery, AL",10:00:00,5,2018-08-04T10:00:00-0500,https://www.facebook.com/events/2231132303568802/,Door Knock with Tabitha - Montgomery,https://www.facebook.com/TabithaIsner/,8/4/2018
,,,sb,,,,Door Knocking and Office Grand Opening with Tabitha - Dothan,"Come and talk to your neighbors! The Isner Campaign is hosting a Canvass Kick Off Event in Dothan on Saturday, August 11 at the Campaign HQ! AND we will be hosting a ribbon cutting at our Dothan Office! Canvass shifts are 10-12 and 1-3. Ribbon Cutting and lunch at 12 pm. 

Please RSVP here: https://secure.ngpvan.com/lKtrtwuo-EGavh8bCa0T-Q2",,,,"2251 S Oates St, Dothan, AL 36301-5063, United States - ",10:00:00,5,2018-08-11T10:00:00-0500,https://www.facebook.com/events/491269838004680/,Door Knocking and Office Grand Opening with Tabitha - Dothan,https://www.facebook.com/TabithaIsner/,8/11/2018
,,,sb,,,,Door Knocking and Office Grand Opening with Tabitha - Dothan,"Come and talk to your neighbors! The Isner Campaign is hosting a Canvass Kick Off Event in Dothan on Saturday, August 11 at the Campaign HQ! AND we will be hosting a ribbon cutting at our Dothan Office! Canvass shifts are 10-12 and 1-3. Ribbon Cutting and lunch at 12 pm. 

Please RSVP here: https://secure.ngpvan.com/lKtrtwuo-EGavh8bCa0T-Q2",,,,"2251 S Oates St, Dothan, AL 36301-5063, United States - ",10:00:00,5,2018-08-11T10:00:00-0500,https://www.facebook.com/events/491269838004680/,Door Knocking and Office Grand Opening with Tabitha - Dothan,https://www.facebook.com/TabithaIsner/,8/11/2018
,,,sb,,,,Door Knocking for Drew!,Join us as we walk the walk for Drew! We'll be knocking doors and talking to voters so we can #TakeBackOklahoma in November. No experience necessary. Join us!,,,,"Tulsa HQ - 1617 S. Utica Ave. Tulsa, OK 74104 - ",10:00:00,5,2018-08-04T10:00:00-0500,https://www.facebook.com/events/223236378267552/,Door Knocking for Drew!,https://www.facebook.com/drewforoklahoma/,8/4/2018
